{
  "schemaVersion": "digital-twin.state.v1",
  "twinId": "TWIN-KALEIDOS-PUBLIC-SAFE-001",
  "asOf": "2026-07-06T15:00:05Z",
  "entities": [
    {
      "entityId": "KAL-01-CORE",
      "unitId": "KAL-01",
      "displayName": "KAL-01 core region",
      "viewportEntity": "core",
      "values": [
        {
          "valueId": "VAL-KAL-01-MEASURED-FLUX-LOW",
          "label": "Flux Axial Low",
          "valueBasis": "measured",
          "unit": "relative-flux",
          "value": { "scalar": 0.76 },
          "confidence": 0.92,
          "freshness": { "ageSec": 5, "status": "fresh" },
          "lineageId": "LIN-KAL-01-FLUX-LOW",
          "sourceIds": ["TAG-KAL-01-FLUX-LOW"]
        },
        {
          "valueId": "VAL-KAL-01-MEASURED-FLUX-MID",
          "label": "Flux Axial Mid",
          "valueBasis": "measured",
          "unit": "relative-flux",
          "value": { "scalar": 0.88 },
          "confidence": 0.92,
          "freshness": { "ageSec": 5, "status": "fresh" },
          "lineageId": "LIN-KAL-01-FLUX-MID",
          "sourceIds": ["TAG-KAL-01-FLUX-MID"]
        },
        {
          "valueId": "VAL-KAL-01-MEASURED-FLUX-HIGH",
          "label": "Flux Axial High",
          "valueBasis": "measured",
          "unit": "relative-flux",
          "value": { "scalar": 0.81 },
          "confidence": 0.92,
          "freshness": { "ageSec": 5, "status": "fresh" },
          "lineageId": "LIN-KAL-01-FLUX-HIGH",
          "sourceIds": ["TAG-KAL-01-FLUX-HIGH"]
        },
        {
          "valueId": "VAL-KAL-01-IMPUTED-CORE-DISTRIBUTION",
          "label": "Core Power Distribution Estimate",
          "valueBasis": "imputed",
          "unit": "coarse map",
          "value": { "state": "axial mid-biased" },
          "confidence": 0.76,
          "freshness": { "ageSec": 6, "status": "degraded" },
          "lineageId": "LIN-KAL-01-CORE-DISTRIBUTION",
          "sourceIds": [
            "TAG-KAL-01-FLUX-LOW",
            "TAG-KAL-01-FLUX-MID",
            "TAG-KAL-01-FLUX-HIGH",
            "TAG-KAL-01-FLUX-RADIAL-N",
            "TAG-KAL-01-FLUX-RADIAL-S",
            "TAG-KAL-01-DRUM-POSITION",
            "MODEL-KALEIDOS-PRISMATIC-V0"
          ]
        },
        {
          "valueId": "VAL-KAL-01-IMPUTED-BLOCK-TEMP",
          "label": "Unmeasured Fuel/Block Temperature Estimate",
          "valueBasis": "imputed",
          "unit": "degC",
          "value": { "scalar": 688.5 },
          "confidence": 0.72,
          "freshness": { "ageSec": 7, "status": "degraded" },
          "lineageId": "LIN-KAL-01-BLOCK-TEMP",
          "sourceIds": ["TAG-KAL-01-FLUX-MID", "TAG-KAL-01-HELIUM-FLOW", "TAG-KAL-01-BOUNDARY-TEMP", "MODEL-KALEIDOS-PRISMATIC-V0"]
        },
        {
          "valueId": "VAL-KAL-01-IMPUTED-CORE-MARGIN",
          "label": "Local Thermal Margin",
          "valueBasis": "imputed",
          "unit": "percent",
          "value": { "scalar": 18.6 },
          "confidence": 0.78,
          "freshness": { "ageSec": 6, "status": "degraded" },
          "lineageId": "LIN-KAL-01-CORE-MARGIN",
          "sourceIds": ["TAG-KAL-01-FLUX-MID", "TAG-KAL-01-HELIUM-OUTLET", "MODEL-KALEIDOS-PRISMATIC-V0", "RUN-KAL-01-SCHED-DRIFT"]
        },
        {
          "valueId": "VAL-KAL-01-SIMULATED-FORECAST-MARGIN",
          "label": "Simulated Forecast Margin",
          "valueBasis": "simulated",
          "unit": "percent",
          "value": { "scalar": 16.1 },
          "confidence": 0.71,
          "freshness": { "ageSec": 30, "status": "unknown" },
          "lineageId": "LIN-KAL-01-SIM-MARGIN",
          "sourceIds": ["RUN-KAL-01-SCHED-DRIFT", "ARTIFACT-SIMOPS-FORECAST-001"]
        }
      ]
    },
    {
      "entityId": "KAL-01-PRIMARY-LOOP",
      "unitId": "KAL-01",
      "displayName": "KAL-01 primary helium loop",
      "viewportEntity": "primaryLoop",
      "values": [
        {
          "valueId": "VAL-KAL-01-MEASURED-OUTLET-TEMP",
          "label": "Core Outlet Helium Temp",
          "valueBasis": "measured",
          "unit": "degC",
          "value": { "scalar": 612.4 },
          "confidence": 0.9,
          "freshness": { "ageSec": 5, "status": "fresh" },
          "lineageId": "LIN-KAL-01-OUTLET-TEMP",
          "sourceIds": ["TAG-KAL-01-HELIUM-OUTLET"]
        },
        {
          "valueId": "VAL-KAL-01-MEASURED-PRESSURE",
          "label": "Primary Helium Pressure",
          "valueBasis": "measured",
          "unit": "MPa",
          "value": { "scalar": 15.2 },
          "confidence": 0.9,
          "freshness": { "ageSec": 5, "status": "fresh" },
          "lineageId": "LIN-KAL-01-PRESSURE",
          "sourceIds": ["TAG-KAL-01-PRIMARY-PRESSURE"]
        },
        {
          "valueId": "VAL-KAL-01-IMPUTED-HEAT-BALANCE",
          "label": "Helium-Loop Heat Balance",
          "valueBasis": "imputed",
          "unit": "MWt proxy",
          "value": { "scalar": 2.48 },
          "confidence": 0.8,
          "freshness": { "ageSec": 7, "status": "degraded" },
          "lineageId": "LIN-KAL-01-HEAT-BALANCE",
          "sourceIds": ["TAG-KAL-01-HELIUM-INLET", "TAG-KAL-01-HELIUM-OUTLET", "TAG-KAL-01-PRIMARY-PRESSURE", "TAG-KAL-01-HELIUM-FLOW"]
        },
        {
          "valueId": "VAL-KAL-01-IMPUTED-CIRCULATOR-MARGIN",
          "label": "Circulator Operating Margin",
          "valueBasis": "imputed",
          "unit": "percent",
          "value": { "scalar": 22.5 },
          "confidence": 0.74,
          "freshness": { "ageSec": 8, "status": "degraded" },
          "lineageId": "LIN-KAL-01-CIRCULATOR-MARGIN",
          "sourceIds": ["TAG-KAL-01-PRIMARY-PRESSURE", "TAG-KAL-01-HELIUM-FLOW", "TAG-KAL-01-HELIUM-OUTLET"]
        }
      ]
    },
    {
      "entityId": "KAL-01-HEAT-EXCHANGERS",
      "unitId": "KAL-01",
      "displayName": "KAL-01 heat exchangers",
      "viewportEntity": "heatExchangers",
      "values": [
        {
          "valueId": "VAL-KAL-01-IMPUTED-HX-DUTY",
          "label": "Heat-Exchanger Duty Proxy",
          "valueBasis": "imputed",
          "unit": "MWt proxy",
          "value": { "scalar": 2.53 },
          "confidence": 0.77,
          "freshness": { "ageSec": 7, "status": "degraded" },
          "lineageId": "LIN-KAL-01-HX-DUTY",
          "sourceIds": ["TAG-KAL-01-HX-HOT", "TAG-KAL-01-HX-COLD", "TAG-KAL-01-THERMAL-OUTPUT"]
        }
      ]
    },
    {
      "entityId": "KAL-01-POWER-CONVERSION",
      "unitId": "KAL-01",
      "displayName": "KAL-01 power conversion",
      "viewportEntity": "powerConversion",
      "values": [
        {
          "valueId": "VAL-KAL-01-MEASURED-ELECTRIC-OUTPUT",
          "label": "Electric Output",
          "valueBasis": "measured",
          "unit": "MWe",
          "value": { "scalar": 0.94 },
          "confidence": 0.9,
          "freshness": { "ageSec": 5, "status": "fresh" },
          "lineageId": "LIN-KAL-01-ELECTRIC-OUTPUT",
          "sourceIds": ["TAG-KAL-01-ELECTRIC-OUTPUT"]
        }
      ]
    },
    {
      "entityId": "KAL-01-SECONDARY-HEAT-USE",
      "unitId": "KAL-01",
      "displayName": "KAL-01 secondary heat use",
      "viewportEntity": "secondaryHeatUse",
      "values": [
        {
          "valueId": "VAL-KAL-01-MEASURED-THERMAL-OUTPUT",
          "label": "Useful Thermal Output",
          "valueBasis": "measured",
          "unit": "MWt",
          "value": { "scalar": 2.6 },
          "confidence": 0.9,
          "freshness": { "ageSec": 5, "status": "fresh" },
          "lineageId": "LIN-KAL-01-THERMAL-OUTPUT",
          "sourceIds": ["TAG-KAL-01-THERMAL-OUTPUT"]
        },
        {
          "valueId": "VAL-KAL-01-SIMULATED-SERVICE-WINDOW",
          "label": "Simulated Service Window",
          "valueBasis": "simulated",
          "unit": "hours",
          "value": { "scalar": 23.4 },
          "confidence": 0.68,
          "freshness": { "ageSec": 30, "status": "unknown" },
          "lineageId": "LIN-KAL-01-SERVICE-WINDOW",
          "sourceIds": ["RUN-KAL-01-SCHED-DRIFT", "ARTIFACT-SIMOPS-FORECAST-001"]
        }
      ]
    },
    {
      "entityId": "KAL-01-VESSEL",
      "unitId": "KAL-01",
      "displayName": "KAL-01 vessel context",
      "viewportEntity": "vessel",
      "values": [
        {
          "valueId": "VAL-KAL-01-IMPUTED-CONFIDENCE",
          "label": "Imputed Confidence",
          "valueBasis": "imputed",
          "unit": "percent",
          "value": { "scalar": 81 },
          "confidence": 0.81,
          "freshness": { "ageSec": 8, "status": "degraded" },
          "lineageId": "LIN-KAL-01-IMPUTED-CONFIDENCE",
          "sourceIds": ["TAG-KAL-01-FLUX-LOW", "TAG-KAL-01-FLUX-MID", "TAG-KAL-01-FLUX-HIGH", "TAG-KAL-01-HELIUM-OUTLET"]
        }
      ]
    },
    {
      "entityId": "KAL-02-OUTPUT",
      "unitId": "KAL-02",
      "displayName": "KAL-02 ramping output",
      "viewportEntity": "powerConversion",
      "values": [
        {
          "valueId": "VAL-KAL-02-MEASURED-ELECTRIC-OUTPUT",
          "label": "Electric Output",
          "valueBasis": "measured",
          "unit": "MWe",
          "value": { "scalar": 0.52 },
          "confidence": 0.74,
          "freshness": { "ageSec": 240, "status": "stale" },
          "lineageId": "LIN-KAL-02-ELECTRIC-OUTPUT",
          "sourceIds": ["TAG-KAL-02-ELECTRIC-OUTPUT"]
        },
        {
          "valueId": "VAL-KAL-02-MEASURED-THERMAL-OUTPUT",
          "label": "Useful Thermal Output",
          "valueBasis": "measured",
          "unit": "MWt",
          "value": { "scalar": 1.8 },
          "confidence": 0.74,
          "freshness": { "ageSec": 240, "status": "stale" },
          "lineageId": "LIN-KAL-02-THERMAL-OUTPUT",
          "sourceIds": ["TAG-KAL-02-THERMAL-OUTPUT"]
        },
        {
          "valueId": "VAL-KAL-02-IMPUTED-RAMP-MARGIN",
          "label": "Local Thermal Margin",
          "valueBasis": "imputed",
          "unit": "percent",
          "value": { "scalar": 14.2 },
          "confidence": 0.67,